Question Number,Question,Option A,Option B,Option C,Option D,Correct Option
261,Why is hyperparameter tuning important in ML?,It improves model performance.,It hides test labels.,It lowers dataset size.,It resets weights.,A
262,Why are logs useful in debugging?,They show what happened step by step.,They encrypt output files.,They compile the app.,They clean cache folders.,A
263,Why do we use CI/CD in DevOps?,To automate build and deployment.,To generate UI mockups.,To manage customer support.,To shrink container sizes.,A
264,Why is model evaluation necessary?,It checks how well a model performs.,It reduces test data.,It updates the UI.,It changes activation functions.,A
265,Why is class imbalance a problem?,It skews model predictions.,It improves accuracy.,It filters noise better.,It increases training speed.,A
266,Why do we use JSON in web APIs?,It's readable and light.,It's based on HTML.,It's used for styling.,It's built from SQL.,A
267,Why is load balancing used in servers?,It spreads traffic evenly.,It lowers user count.,It encrypts form data.,It blocks cookies.,A
268,Why is HTTPS important for logins?,It encrypts sensitive data.,It reduces load time.,It hides input fields.,It skips routing checks.,A
269,Why do we use environment variables?,They protect secrets in code.,They boost performance.,They log database access.,They compile faster.,A
270,Why is prompt engineering useful in LLMs?,It shapes output by framing input.,It trains new models.,It builds web apps.,It sends alerts.,A
271,Why is cross-validation preferred in model evaluation?,It tests model performance across subsets.,It merges train and test sets.,It speeds up accuracy checks.,It hides validation loss.,A
272,Why do we use clustering in data science?,To group similar data points.,To label images manually.,To encrypt the dataset.,To remove outliers.,A
273,Why are learning curves useful?,They show model performance over time.,They reduce training data.,They split validation sets.,They detect syntax errors.,A
274,Why is data labeling important in supervised learning?,It helps map inputs to correct outputs.,It deletes duplicates.,It lowers feature count.,It compresses image data.,A
275,Why do neural nets use hidden layers?,To capture complex patterns.,To simplify gradients.,To reduce noise.,To block overfitting.,A
276,Why is the F1 score used in imbalanced data?,It balances precision and recall.,It lowers recall rate.,It sorts predictions.,It ignores false negatives.,A
277,Why is a hash function used in security?,It maps input to a fixed-size output.,It changes data types.,It stores cookies.,It uploads backups.,A
278,Why is a test suite used in software development?,It verifies that code behaves as expected.,It encrypts all functions.,It changes app design.,It restarts the server.,A
279,Why is the principle of least privilege important?,It limits access to only what is needed.,It shares data with all users.,It locks admin settings.,It disables backups.,A
280,Why are scalability tests critical before deployment?,To ensure the app handles increased load.,To reduce UI rendering.,To hide memory usage.,To increase DNS requests.,A
281,Why is a data lake used in big data systems?,"It stores raw, unstructured data.",It removes outdated backups.,It filters all network logs.,It blocks API requests.,A
282,Why is a primary key important in databases?,It uniquely identifies each row.,It encrypts table data.,It removes duplicate rows.,It links tables automatically.,A
283,Why is caching used in web apps?,It speeds up page load times.,It stores user passwords.,It blocks browser history.,It compresses font sizes.,A
284,Why is a staging environment used?,It tests changes before production.,It hides database errors.,It doubles app size.,It renames project files.,A
285,Why do developers use virtual environments in Python?,They isolate project dependencies.,They compile Python code.,They encrypt source code.,They connect APIs.,A
286,Why is normalization important in databases?,It reduces data redundancy.,It joins multiple schemas.,It stores encrypted logs.,It skips field constraints.,A
287,Why do we use JOIN in SQL?,To combine rows from related tables.,To delete similar records.,To encrypt passwords.,To backup queries.,A
288,Why is exploratory data analysis done first?,To understand patterns in the data.,To build neural networks.,To increase data size.,To split datasets.,A
289,Why do APIs return status codes?,To show the result of a request.,To delete request headers.,To rename routes.,To encrypt tokens.,A
290,Why is batch processing used in data systems?,It handles large volumes at once.,It updates logs daily.,It compresses text fields.,It streams real-time data.,A
291,Why is unit testing important in development?,It helps ensure code works as expected.,It encrypts project files.,It runs user sessions.,It hides log outputs.,A
292,Why is reproducibility valued in data science?,It ensures consistent results with the same inputs.,It reduces computation cost.,It removes null values.,It blocks file sharing.,A
293,Why is encryption used in messaging apps?,It keeps conversations private.,It syncs contact lists.,It tracks user behavior.,It compresses voice notes.,A
294,Why is agile methodology popular?,"It supports fast, flexible development.",It locks project scope.,It removes testing phases.,It skips documentation.,A
295,Why is cloud backup useful?,It protects data from local failure.,It erases deleted files.,It slows network speed.,It renames file extensions.,A
296,Why do we use data pipelines?,They automate data flow and processing.,They visualize code.,They compress backup files.,They encrypt dashboards.,A
297,Why is server uptime monitoring essential?,It helps avoid unexpected downtimes.,It increases CPU clock speed.,It filters unauthorized users.,It resets all server logs.,A
298,Why is anomaly detection used in finance?,It spots suspicious transactions.,It increases account balance.,It blocks user logins.,It resets password length.,A
299,Why is code refactoring done?,It improves code structure without changing behavior.,It deletes dead links.,It encrypts comments.,It reduces screen glare.,A
300,Why do we use DevOps practices?,They improve collaboration and delivery speed.,They lock version history.,They split project files.,They compile JavaScript.,A
301,Why is versioning important in API development?,It ensures backward compatibility.,It hides error codes.,It speeds up request time.,It blocks user access.,A
302,Why is semantic HTML used in web development?,It improves accessibility and SEO.,It increases image resolution.,It deletes extra lines.,It adds animation effects.,A
303,Why is data wrangling essential in analysis?,It cleans and reshapes messy data.,It hides missing values.,It compresses datasets.,It sorts labels alphabetically.,A
304,Why is latency a key metric in networking?,It measures delay in data transfer.,It reduces browser size.,It encrypts file names.,It reroutes DNS entries.,A
305,Why do developers use linters?,To catch errors and enforce code style.,To generate tests.,To compress the repo.,To render images faster.,A
306,Why are graphs used in knowledge representation?,They show relationships between entities.,They rank web pages.,They clean training data.,They reduce CPU cycles.,A
307,Why is edge computing used in IoT?,It reduces data travel distance.,It encrypts device logs.,It backs up cloud files.,It merges IP addresses.,A
308,Why is the minimum viable product (MVP) approach effective?,It validates ideas with minimal effort.,It removes marketing needs.,It skips testing stages.,It limits user feedback.,A
309,Why is containerization helpful in deployment?,It makes apps portable across systems.,It shortens Python scripts.,It disables REST APIs.,It encrypts YAML files.,A
310,Why is database indexing a performance booster?,It speeds up data retrieval.,It merges columns.,It hides joins.,It compresses keys.,A
311,Why do neurons in the brain form synaptic connections?,To transmit signals between cells.,To increase blood flow.,To produce hormones.,To digest proteins.,A
312,Why is the hippocampus vital for memory?,It helps form and store memories.,It regulates heartbeat.,It controls reflexes.,It processes visual input.,A
313,Why do enzymes speed up chemical reactions?,They lower the activation energy.,They raise cell temperature.,They consume oxygen.,They change DNA sequences.,A
314,Why is the placebo effect significant in studies?,It shows how belief can influence outcomes.,It controls the sample size.,It ensures double-blinding.,It removes test bias.,A
315,Why is dopamine linked to motivation and reward?,It influences pleasure and reinforcement.,It increases heart rate.,It digests nutrients.,It stores calcium.,A
316,Why is REM sleep important?,It's linked to dreaming and memory.,It raises blood sugar.,It burns fat faster.,It strengthens bones.,A
317,Why is the cerebellum essential for coordination?,It fine-tunes motor movements.,It interprets sounds.,It filters toxins.,It regulates hunger.,A
318,Why is serotonin linked to mood?,It helps regulate emotions.,It fuels muscle growth.,It controls vision.,It breaks down glucose.,A
319,Why is homeostasis crucial in biology?,It maintains internal balance.,It speeds up reactions.,It removes DNA errors.,It causes mutation.,A
320,Why is Pavlov's experiment important in psychology?,It demonstrated classical conditioning.,It mapped brain regions.,It defined IQ testing.,It showed language use.,A
321,Why is natural selection central to evolution?,It explains how traits that aid survival spread.,It describes cell division.,It predicts mating behavior.,It maps brain structure.,A
322,Why do white blood cells protect the body?,They destroy harmful invaders.,They store energy.,They deliver oxygen.,They produce insulin.,A
323,Why is the amygdala linked to fear?,It helps process emotional responses.,It controls balance.,It increases muscle tone.,It boosts heart function.,A
324,Why is behavioral therapy used in mental health?,It helps change negative thought patterns.,It regulates sleep.,It boosts digestion.,It tracks body temperature.,A
325,Why are stem cells medically valuable?,They can become many types of cells.,They kill bacteria.,They store memories.,They break down fat.,A
326,Why is Maslow’s hierarchy important in psychology?,It explains human motivation and needs.,It treats eating disorders.,It scores intelligence.,It studies vision.,A
327,Why do vaccines build immunity?,They train the body to fight disease.,They clean the blood.,They raise body temperature.,They cure infections directly.,A
328,Why is the prefrontal cortex important?,It handles decision-making and planning.,It aids breathing.,It controls reflexes.,It stores visual data.,A
329,Why is the scientific method key in research?,It provides a structured way to test ideas.,It limits experiment size.,It proves all hypotheses.,It shows public opinion.,A
330,Why is metabolism vital for life?,It supports energy production in cells.,It makes proteins.,It forms white blood cells.,It stores excess vitamins.,A
331,Why is observational learning important in psychology?,It shows how behavior is learned by watching others.,It predicts language acquisition.,It explains memory loss.,It monitors vital signs.,A
332,Why do cells undergo mitosis?,To create identical daughter cells.,To digest nutrients.,To transfer DNA.,To remove bacteria.,A
333,Why is cortisol known as a stress hormone?,It’s released during stress to help respond.,It lowers blood pressure.,It sharpens vision.,It improves sleep.,A
334,Why is peer review essential in science?,It validates findings through critique.,It speeds up publication.,It encrypts reports.,It replaces lab tests.,A
335,Why is self-actualization the top of Maslow’s hierarchy?,It represents reaching full potential.,It reflects basic needs.,It controls anxiety.,It regulates emotions.,A
336,Why is the autonomic nervous system critical?,It controls involuntary body functions.,It repairs muscle tissue.,It stores genetic info.,It digests complex carbs.,A
337,Why is cognitive dissonance uncomfortable?,It results from conflicting beliefs.,It reduces memory strength.,It triggers hunger.,It affects heart rate.,A
338,Why is the spinal cord vital to the nervous system?,It transmits signals between brain and body.,It stores red blood cells.,It cools the brain.,It filters waste.,A
339,Why is empathy important in social behavior?,It helps people understand others’ feelings.,It raises blood oxygen.,It reduces eye strain.,It improves digestion.,A
340,Why is the endocrine system essential in the body?,It produces hormones for regulation.,It supports bone movement.,It stores white cells.,It filters air.,A
341,Why is the limbic system important in psychology?,It regulates emotions and memory.,It manages muscle movement.,It filters spinal signals.,It strengthens bones.,A
342,Why is protein synthesis essential in biology?,It builds the proteins needed for life.,It speeds up cell death.,It breaks down enzymes.,It filters cellular waste.,A
343,Why is exposure therapy used in anxiety treatment?,It helps patients face and reduce fears.,It increases memory recall.,It blocks stress hormones.,It boosts metabolism.,A
344,Why is osmosis crucial for cell survival?,It balances water across cell membranes.,It absorbs oxygen.,It prevents nerve impulses.,It stores glucose.,A
345,Why is classical conditioning studied in psychology?,It shows how behaviors are learned through association.,It increases neural speed.,It repairs brain damage.,It tracks hormone levels.,A
346,Why is insulin important for the human body?,It regulates blood sugar levels.,It stores protein.,It strengthens ligaments.,It forms blood cells.,A
347,Why is short-term memory limited in capacity?,It can hold only a few items briefly.,It stores sensory input.,It deletes emotional memories.,It slows thought speed.,A
348,Why do antidepressants affect serotonin levels?,To help balance mood in patients.,To block pain receptors.,To improve lung capacity.,To increase bone density.,A
349,Why is blood pressure regulation important?,It maintains safe circulation levels.,It filters white cells.,It processes vision data.,It clears brain fog.,A
350,Why is behavioral reinforcement used in training?,It strengthens desired responses through rewards.,It raises resting heart rate.,It shrinks emotional bias.,It stops reflex loops.,A
351,Why is the skin considered the first line of defense?,It forms a physical barrier against pathogens.,It stores red blood cells.,It produces antibodies.,It boosts energy.,A
352,Why is the scientific method iterative?,It evolves as new evidence is found.,It only applies to physics.,It ends after one trial.,It avoids data collection.,A
353,Why is the sympathetic nervous system activated in emergencies?,It prepares the body for fight or flight.,It controls digestion.,It slows breathing.,It boosts hearing.,A
354,Why are placebos used in clinical trials?,To measure effects of treatment versus belief.,To reduce dosage.,To test for allergies.,To track hydration.,A
355,Why is the cerebrum key in complex thought?,"It handles logic, memory, and decisions.",It controls movement only.,It filters toxins.,It stores oxygen.,A
356,Why are electrolytes essential in biology?,They help cells transmit electrical signals.,They burn calories.,They boost hormone levels.,They dissolve protein.,A
357,Why is behavioral psychology focused on observable actions?,It studies behavior that can be measured.,It analyzes dreams.,It tests muscle strength.,It enhances taste perception.,A
358,Why is the hypothalamus vital to homeostasis?,"It regulates temperature, hunger, and hormones.",It manages breathing rhythm.,It produces white cells.,It powers brain waves.,A
359,Why are neurotransmitters important in the nervous system?,They carry signals between neurons.,They clean blood vessels.,They regulate sleep cycles.,They increase lung size.,A
360,Why is experimental control crucial in research?,It isolates variables to test causality.,It speeds up data entry.,It removes bias automatically.,It summarizes findings.,A
361,Why is genetic variation important in populations?,It increases chances of survival and adaptation.,It stops DNA replication.,It reduces reproduction.,It deletes old genes.,A
362,Why is the myelin sheath important for neurons?,It speeds up signal transmission.,It stores neurotransmitters.,It filters impulses.,It produces red blood cells.,A
363,Why is the placebo effect a concern in experiments?,It can influence results without real treatment.,It raises drug costs.,It speeds up dosage.,It prevents bias.,A
364,Why is the retina essential for vision?,It contains cells that detect light.,It supports eye movement.,It filters sound.,It digests nutrients.,A
365,Why is reinforcement scheduling studied in behaviorism?,It affects how often behaviors are repeated.,It boosts memory.,It blocks motor signals.,It increases brain size.,A
366,Why is circadian rhythm important in biology?,It regulates sleep-wake cycles.,It digests proteins.,It stops infections.,It builds muscles.,A
367,Why is the frontal lobe important for personality?,It contributes to self-control and decision-making.,It regulates heartbeat.,It filters pain.,It stores vitamins.,A
368,Why is schema theory used in psychology?,It explains how knowledge is organized and used.,It tracks emotional triggers.,It lowers stress.,It alters brain chemistry.,A
369,Why is the immune response specific to antigens?,It targets only recognized threats.,It boosts respiration.,It blocks digestion.,It filters vision.,A
370,Why is the visual cortex critical for seeing?,It processes visual input from the eyes.,It controls blinking speed.,It forms memories.,It stores speech patterns.,A
371,Why is the parasympathetic nervous system important?,It calms the body after stress.,It speeds up digestion.,It increases blood pressure.,It blocks muscle reflexes.,A
372,Why is the thalamus considered a relay station in the brain?,It directs sensory information to the cortex.,It stores motor memories.,It regulates reflex arcs.,It triggers adrenaline.,A
373,Why is classical conditioning relevant in advertising?,It links positive feelings with products.,It lowers costs.,It increases memory span.,It controls shopping times.,A
374,Why is the blood-brain barrier critical?,It protects the brain from harmful substances.,It increases oxygen flow.,It enhances hearing.,It regulates vision.,A
375,Why is the spinal reflex arc important?,It allows fast responses without brain input.,It slows down muscle contraction.,It stores pain information.,It increases nerve size.,A
376,Why is the preoperational stage key in Piaget’s theory?,It involves symbolic thinking and egocentrism.,It covers language loss.,It forms scientific reasoning.,It ends physical growth.,A
377,Why is the amygdala overactive in anxiety disorders?,It heightens fear response to perceived threats.,It reduces cortisol.,It slows down thoughts.,It filters dopamine.,A
378,Why is long-term potentiation studied in neuroscience?,It helps explain how memories are strengthened.,It slows reaction time.,It prevents neuron death.,It blocks pain receptors.,A
379,Why is operant conditioning used in behavior training?,It shapes actions using rewards and punishments.,It hides emotional triggers.,It shortens learning time.,It boosts IQ scores.,A
380,Why is the pituitary gland called the master gland?,It regulates many other endocrine glands.,It stores calcium.,It produces insulin.,It filters blood toxins.,A
381,Why is the medulla oblongata essential for survival?,It controls vital functions like breathing and heart rate.,It stores long-term memories.,It digests nutrients.,It generates motor impulses.,A
382,Why is observational research used in psychology?,It allows studying behavior in natural settings.,It creates artificial responses.,It boosts cognitive function.,It tracks hormonal levels.,A
383,Why is the Broca's area important for language?,It helps with speech production.,It stores vocabulary.,It controls reading speed.,It manages hearing.,A
384,Why is the sodium-potassium pump vital in neurons?,It maintains the resting potential.,It creates myelin.,It releases serotonin.,It speeds up reflexes.,A
385,Why is working memory important in cognitive tasks?,It temporarily holds information for processing.,It stores emotional reactions.,It encodes long-term memory.,It filters distractions.,A
386,Why is habituation considered a basic form of learning?,It involves decreased response to repeated stimuli.,It reinforces new behaviors.,It increases cognitive load.,It activates reward systems.,A
387,Why is the occipital lobe crucial for vision?,It processes visual information from the eyes.,It balances sound input.,It adjusts body temperature.,It interprets language.,A
388,Why is informed consent important in research ethics?,It respects participants' autonomy and choice.,It increases survey size.,It shortens the experiment.,It anonymizes results.,A
389,Why is the placebo group needed in clinical trials?,It helps isolate the treatment effect.,It hides data anomalies.,It ensures double-blind design.,It extends trial length.,A
390,Why is acetylcholine important in muscle control?,It triggers muscle contractions.,It reduces stress levels.,It balances blood sugar.,It cools down tissues.,A
391,Why is the hypothalamus important in maintaining body temperature?,It acts as the body’s thermostat.,It circulates blood.,It stores oxygen.,It pumps hormones.,A
392,Why is the temporal lobe essential for hearing?,It processes auditory information.,It balances body movements.,It regulates sleep patterns.,It stores immune responses.,A
393,Why is the concept of neuroplasticity groundbreaking?,It shows the brain can adapt and change.,It increases spinal growth.,It stores hormone levels.,It fixes bone fractures.,A
394,Why is random assignment used in experiments?,It helps reduce selection bias.,It speeds up trials.,It guarantees better results.,It shortens sample size.,A
395,Why is motor cortex stimulation used in treatment?,It helps retrain damaged movement pathways.,It removes brain tumors.,It increases blood volume.,It controls hearing.,A
396,Why is implicit memory different from explicit memory?,It operates without conscious awareness.,It stores only visual memories.,It improves heart function.,It affects muscle growth.,A
397,Why is the vestibular system essential for balance?,It detects head movement and orientation.,It filters food intake.,It controls blood sugar.,It sharpens vision.,A
398,Why is fMRI used in brain research?,It maps brain activity through blood flow.,It freezes brain movement.,It creates sound maps.,It tests muscle reaction.,A
399,Why is psychological resilience important?,It helps people recover from adversity.,It boosts IQ.,It changes physical strength.,It reduces sugar levels.,A
400,Why is the theory of operant conditioning relevant in parenting?,It explains how behavior can be shaped by rewards.,It boosts physical coordination.,It controls sleep cycles.,It increases memory recall.,A
401,Why is SWOT analysis used in business strategy?,"It helps identify strengths, weaknesses, opportunities, and threats.",It predicts future sales.,It balances budgets.,It merges departments.,A
402,Why is customer segmentation important in marketing?,It allows targeting of specific consumer groups.,It raises product prices.,It increases refund rates.,It replaces product testing.,A
403,Why is brand positioning crucial for a company?,It defines how a brand is perceived in the market.,It lowers advertising costs.,It automates packaging.,It designs store layouts.,A
404,Why is content marketing effective?,It builds trust through valuable information.,It shortens customer service time.,It lowers website speed.,It avoids competitor research.,A
405,Why is ROI a key metric in marketing?,It shows the return on investment from campaigns.,It filters spam emails.,It replaces customer feedback.,It deletes user data.,A
406,Why is A/B testing used in digital marketing?,It compares performance of two variants.,It creates new landing pages.,It blocks pop-ups.,It encrypts URLs.,A
407,Why is email personalization important in campaigns?,It increases engagement by addressing individual interests.,It reduces email length.,It changes subject lines.,It adds attachments.,A
408,Why is a sales funnel useful in marketing?,It outlines stages of the customer journey.,It renames product features.,It manages warehouse stock.,It filters employees.,A
409,Why is customer lifetime value (CLV) important?,It estimates total revenue from a customer.,It tracks daily sales.,It logs user behavior.,It hides discounts.,A
410,Why is competitor analysis vital in marketing strategy?,It informs how to position against rivals.,It increases customer loyalty.,It deletes price tags.,It adds shipping fees.,A
411,Why is product-market fit critical for startups?,It shows there is demand for the product.,It increases ad spending.,It builds warehouse capacity.,It automates hiring.,A
412,Why is customer feedback valuable in product development?,It guides improvements based on real use.,It boosts manufacturing speed.,It deletes negative reviews.,It alters shipping costs.,A
413,Why is brand equity important for businesses?,It reflects the value customers place on a brand.,It tracks inventory levels.,It reduces payroll.,It filters spam traffic.,A
414,Why is the 4Ps model used in marketing?,"It covers product, price, place, and promotion.",It measures production time.,It manages HR policies.,It schedules meetings.,A
415,Why is storytelling used in branding?,It helps emotionally connect with customers.,It lowers website traffic.,It reduces product size.,It filters customer data.,A
416,Why is value proposition important?,It explains why a product is worth buying.,It details manufacturing cost.,It measures click rates.,It changes ad targeting.,A
