Question Number,Question,Option A,Option B,Option C,Option D,Correct Option
154,Why do organizations use VPNs?,To secure remote connections over public networks.,To increase data usage limits.,To compress audio files.,To bypass operating system updates.,A
155,Why is gradient descent used in machine learning?,It minimizes the cost function by adjusting weights.,It balances the dataset features.,It multiplies loss with accuracy.,It normalizes output probabilities.,A
156,Why is NAT used in routers?,To map private IP addresses to a public one.,To store website data offline.,To test bandwidth speeds.,To connect two different ISPs.,A
157,Why is transfer learning beneficial in deep learning?,It allows reuse of pretrained models on new tasks.,It resets model weights automatically.,It removes feature correlation.,It trains a model with zero data.,A
158,Why is an IP address important in a network?,It uniquely identifies each device.,It limits internet access.,It controls signal strength.,It stores login credentials.,A
159,Why is feature engineering critical in data science?,It improves model performance by creating better input variables.,It reduces the size of the dataset.,It increases the number of test cases.,It replaces model evaluation.,A
160,Why are APIs essential in modern software development?,They enable different systems to communicate.,They speed up computer boot time.,They replace firewalls in applications.,They encrypt data for browsers.,A
161,Why do load balancers improve system reliability?,They distribute traffic across multiple servers.,They block malicious users.,They reduce storage costs.,They encrypt database entries.,A
162,Why is L2 regularization useful in model training?,It discourages large weights to reduce overfitting.,It forces weights to become zero.,It increases model complexity.,It multiplies accuracy scores.,A
163,Why do we use ARP in computer networks?,To map IP addresses to MAC addresses.,To resolve domain names.,To assign dynamic IPs.,To monitor internet speed.,A
164,Why is early stopping used during training?,To prevent overfitting by halting when validation loss increases.,To decrease learning rate automatically.,To switch optimizers mid-training.,To reset all model weights.,A
165,Why do systems use RAID for storage?,To improve data redundancy and performance.,To cool hard drives.,To encrypt file systems.,To share files across browsers.,A
166,Why are SSL certificates important for websites?,They enable encrypted communication with users.,They boost page load speed.,They remove JavaScript errors.,They create backup copies.,A
167,Why is tokenization important in NLP?,It breaks text into meaningful units for processing.,It creates summaries of documents.,It sorts words alphabetically.,It removes stopwords automatically.,A
168,Why is AI used in fraud detection?,It can identify unusual patterns in large datasets.,It encrypts user credentials.,It stores audit logs.,It increases account balances.,A
169,Why are CDNs used in web delivery?,To cache content closer to users for faster access.,To block malware downloads.,To convert HTML to CSS.,To host server-side code.,A
170,Why is F1-score important in imbalanced datasets?,It balances precision and recall.,It measures only accuracy.,It increases true negatives.,It reduces memory usage.,A
171,Why is data preprocessing essential in machine learning?,It ensures data quality and consistency.,It reduces model memory usage.,It converts accuracy into loss.,It creates neural network layers.,A
172,Why is SSH preferred over Telnet for remote login?,It encrypts communication for security.,It uses more bandwidth.,It runs only on Windows systems.,It blocks all port access.,A
173,Why is dimensionality reduction used in data science?,To reduce noise and improve model efficiency.,To increase data complexity.,To duplicate features.,To slow down predictions.,A
174,Why do we use hashing in cybersecurity?,To verify data integrity.,To create new usernames.,To block email attachments.,To measure password length.,A
175,Why is JSON commonly used for APIs?,It is lightweight and easy to parse.,It encrypts data automatically.,It adds latency to requests.,It needs a database to run.,A
176,Why is modular programming useful in software development?,"It breaks code into manageable, reusable parts.",It speeds up Wi-Fi connection.,It merges all logic into one file.,It removes all function calls.,A
177,Why is bias a problem in AI models?,It causes unfair or inaccurate predictions.,It increases model size.,It improves precision but reduces speed.,It leads to zero loss.,A
178,Why is cloud computing scalable?,It adjusts resources based on demand.,It uses physical servers only.,It stores files in CSV format.,It avoids user input completely.,A
179,Why is it useful to use indexes in a database?,They speed up query retrieval.,They delete duplicate records.,They sort columns alphabetically.,They reduce data accuracy.,A
180,Why is two-factor authentication safer than passwords alone?,It requires both something you know and something you have.,It hides the login screen.,It replaces firewalls.,It delays account creation.,A
181,Why is scaling input features important for gradient-based algorithms?,It helps the algorithm converge faster.,It filters out noisy inputs.,It skips feature selection.,It combines features into one.,A
182,Why do operating systems use virtual memory?,To use hard drive space when RAM is full.,To increase screen resolution.,To secure user login sessions.,To reduce CPU power.,A
183,Why is precision important in classification problems?,It measures accuracy for positive predictions.,It counts all errors equally.,It increases the test set size.,It helps sort the dataset.,A
184,Why are convolutional layers used in image processing?,They capture spatial features in data.,They add color to grayscale images.,They split images into patches.,They change brightness.,A
185,Why is logging important in software applications?,It helps monitor and debug issues.,It stores password data.,It compresses memory usage.,It increases file size.,A
186,Why do we split data into training and test sets?,To evaluate how well the model generalizes.,To reduce the training time.,To increase validation loss.,To clean the dataset.,A
187,Why is recursion used in programming?,It simplifies problems by calling functions within themselves.,It speeds up database queries.,It reduces network load.,It stores user preferences.,A
188,Why is latency critical in online gaming?,It affects how quickly actions register.,It increases screen brightness.,It stores saved progress.,It adjusts speaker volume.,A
189,Why do companies use version control systems?,To track and manage changes in code.,To store large media files.,To delete outdated software.,To rename project folders.,A
190,Why is it better to use environment variables for secrets?,They keep sensitive data out of codebases.,They speed up code execution.,They double memory access.,They prevent app deployment.,A
191,Why do cloud-native applications benefit from microservices?,They allow independent deployment and scaling.,They store logs in shared folders.,They run only on one server.,They disable version control.,A
192,Why is HTTPS preferred for e-commerce websites?,"It encrypts data, ensuring secure transactions.",It compresses shopping cart size.,It supports only one browser type.,It reduces webpage loading speed.,A
193,Why is feature selection used before training a model?,It removes irrelevant inputs to improve accuracy.,It adds noise to training data.,It deletes all output labels.,It sorts columns alphabetically.,A
194,Why are edge computing solutions gaining popularity?,They reduce latency by processing data near the source.,They use centralized servers only.,They slow down client responses.,They store backups in the cloud.,A
195,Why is a confusion matrix useful in classification problems?,It visualizes true/false positives and negatives.,It changes output labels.,It compresses feature sets.,It measures training time.,A
196,Why do DevOps teams use CI/CD pipelines?,They automate integration and delivery steps.,They delete code after deployment.,They improve internet speed.,They increase server temperature.,A
197,Why is anomaly detection important in cybersecurity?,It identifies unusual patterns that may indicate threats.,It locks user accounts.,It changes encryption keys.,It shuts down all systems.,A
198,Why do we need encryption in communication?,To protect information from unauthorized access.,To speed up file downloads.,To improve keyboard accuracy.,To hide screen brightness.,A
199,Why is the softmax function used in classification?,It converts outputs into probabilities.,It filters missing values.,It renames class labels.,It adds training noise.,A
200,Why is monitoring CPU usage critical in servers?,To detect overload and maintain performance.,To cool the hard disk.,To rename operating systems.,To install graphic drivers.,A
201,Why is a GPU better than a CPU for deep learning?,It processes parallel tasks efficiently.,It stores more hard disk space.,It lowers the model's size.,It deletes test datasets.,A
202,Why is regularization used in machine learning?,To reduce overfitting by penalizing complexity.,To clean missing data entries.,To sort variables alphabetically.,To duplicate hidden layers.,A
203,Why do developers use REST APIs?,They allow standardized access to web services.,They restart servers automatically.,They store data as audio files.,They encrypt HTTP headers.,A
204,Why is JSON favored over XML in APIs?,It's lighter and easier to parse.,It supports images directly.,It replaces HTML in browsers.,It changes IP addresses.,A
205,Why is recall important in a classification model?,It measures how many actual positives were identified.,It increases test set length.,It counts all true negatives.,It filters noisy outputs.,A
206,Why is container orchestration needed in cloud apps?,It manages deployment and scaling of containers.,It builds new operating systems.,It encrypts Docker images.,It blocks internet traffic.,A
207,Why is the Adam optimizer popular in deep learning?,It adapts learning rates for each parameter.,It increases batch size.,It shortens training data.,It replaces backpropagation.,A
208,Why is IPv6 adoption important?,It provides more address space than IPv4.,It runs only on fiber networks.,It uses longer domain names.,It disables DNS lookups.,A
209,Why is Git used in software development?,It tracks changes and supports collaboration.,It compiles the codebase.,It stores only video files.,It scans for malware.,A
210,Why is synthetic data used in AI training?,It supplements real data when limited.,It skips data preprocessing.,It prevents model training.,It lowers GPU usage.,A
211,Why is transfer learning used in AI?,It reuses knowledge from existing models.,It skips the training process.,It stores new datasets locally.,It reduces server temperature.,A
212,Why is SSH used instead of Telnet?,It encrypts data during transfer.,It boosts internet speed.,It adds new network devices.,It removes DNS entries.,A
213,Why is anomaly detection used in monitoring systems?,It flags events that deviate from norms.,It labels training data.,It delays alerts by design.,It converts logs to images.,A
214,Why is a confusion matrix helpful?,It shows classification performance.,It measures training loss.,It predicts future outcomes.,It replaces test data.,A
215,Why is dropout used during training?,It prevents overfitting by turning off neurons.,It adds noise to output.,It resets batch size.,It adjusts learning rate.,A
216,Why is an API gateway useful in microservices?,It manages requests between services.,It merges logs into one file.,It encrypts mobile apps.,It slows traffic.,A
217,Why is indexing used in databases?,It speeds up search queries.,It hides primary keys.,It reduces storage space.,It filters column types.,A
218,Why is a load balancer used in web services?,It splits traffic among servers.,It deletes cache on reload.,It switches IP addresses.,It generates backup logs.,A
219,Why is multi-factor authentication safer?,It combines multiple ID methods.,It uses stronger passwords.,It hides the login screen.,It deletes session history.,A
220,Why are epochs important in training models?,They define passes through data.,They replace optimizers.,They reduce feature count.,They modify input format.,A
221,Why is HTTPS considered secure for data transfer?,It encrypts the communication channel.,It reduces file size.,It hides the URL path.,It blocks image loading.,A
222,Why do we use firewalls in network systems?,They block unauthorized access.,They delete backup files.,They restart applications.,They scan user photos.,A
223,Why is CPU cache useful in computing?,It stores frequently used data nearby.,It extends battery life.,It compresses files.,It controls screen brightness.,A
224,Why is accuracy alone misleading in imbalanced data?,It ignores the minority class performance.,It lowers model complexity.,It changes the loss function.,It removes class labels.,A
225,Why do we compress files before transmission?,To reduce the size for faster transfer.,To secure the content.,To rename the extension.,To change file format.,A
226,Why is latency important in real-time systems?,It impacts how quickly responses are received.,It changes hardware speed.,It controls display resolution.,It encrypts voice data.,A
227,Why do we use the 'ping' command?,To check network connectivity.,To increase download speed.,To reset the modem.,To trace active ports.,A
228,Why is modular code preferred in large projects?,It's easier to maintain and debug.,It runs on mobile faster.,It blocks external updates.,It rewrites itself.,A
229,Why is MFA considered a best practice?,It reduces risk with multiple verification steps.,It hides password length.,It disables device syncing.,It renames login fields.,A
230,Why are backups essential in IT systems?,They restore data after loss or failure.,They double hard drive space.,They convert files to apps.,They reduce CPU usage.,A
191,Why do cloud-native applications benefit from microservices?,They allow independent deployment and scaling.,They store logs in shared folders.,They run only on one server.,They disable version control.,A
192,Why is HTTPS preferred for e-commerce websites?,"It encrypts data, ensuring secure transactions.",It compresses shopping cart size.,It supports only one browser type.,It reduces webpage loading speed.,A
193,Why is feature selection used before training a model?,It removes irrelevant inputs to improve accuracy.,It adds noise to training data.,It deletes all output labels.,It sorts columns alphabetically.,A
194,Why are edge computing solutions gaining popularity?,They reduce latency by processing data near the source.,They use centralized servers only.,They slow down client responses.,They store backups in the cloud.,A
195,Why is a confusion matrix useful in classification problems?,It visualizes true/false positives and negatives.,It changes output labels.,It compresses feature sets.,It measures training time.,A
196,Why do DevOps teams use CI/CD pipelines?,They automate integration and delivery steps.,They delete code after deployment.,They improve internet speed.,They increase server temperature.,A
197,Why is anomaly detection important in cybersecurity?,It identifies unusual patterns that may indicate threats.,It locks user accounts.,It changes encryption keys.,It shuts down all systems.,A
198,Why do we need encryption in communication?,To protect information from unauthorized access.,To speed up file downloads.,To improve keyboard accuracy.,To hide screen brightness.,A
199,Why is the softmax function used in classification?,It converts outputs into probabilities.,It filters missing values.,It renames class labels.,It adds training noise.,A
200,Why is monitoring CPU usage critical in servers?,To detect overload and maintain performance.,To cool the hard disk.,To rename operating systems.,To install graphic drivers.,A
201,Why is a GPU better than a CPU for deep learning?,It processes parallel tasks efficiently.,It stores more hard disk space.,It lowers the model's size.,It deletes test datasets.,A
202,Why is regularization used in machine learning?,To reduce overfitting by penalizing complexity.,To clean missing data entries.,To sort variables alphabetically.,To duplicate hidden layers.,A
203,Why do developers use REST APIs?,They allow standardized access to web services.,They restart servers automatically.,They store data as audio files.,They encrypt HTTP headers.,A
204,Why is JSON favored over XML in APIs?,It's lighter and easier to parse.,It supports images directly.,It replaces HTML in browsers.,It changes IP addresses.,A
205,Why is recall important in a classification model?,It measures how many actual positives were identified.,It increases test set length.,It counts all true negatives.,It filters noisy outputs.,A
206,Why is container orchestration needed in cloud apps?,It manages deployment and scaling of containers.,It builds new operating systems.,It encrypts Docker images.,It blocks internet traffic.,A
207,Why is the Adam optimizer popular in deep learning?,It adapts learning rates for each parameter.,It increases batch size.,It shortens training data.,It replaces backpropagation.,A
208,Why is IPv6 adoption important?,It provides more address space than IPv4.,It runs only on fiber networks.,It uses longer domain names.,It disables DNS lookups.,A
209,Why is Git used in software development?,It tracks changes and supports collaboration.,It compiles the codebase.,It stores only video files.,It scans for malware.,A
210,Why is synthetic data used in AI training?,It supplements real data when limited.,It skips data preprocessing.,It prevents model training.,It lowers GPU usage.,A
211,Why is transfer learning used in AI?,It reuses knowledge from existing models.,It skips the training process.,It stores new datasets locally.,It reduces server temperature.,A
212,Why is SSH used instead of Telnet?,It encrypts data during transfer.,It boosts internet speed.,It adds new network devices.,It removes DNS entries.,A
213,Why is anomaly detection used in monitoring systems?,It flags events that deviate from norms.,It labels training data.,It delays alerts by design.,It converts logs to images.,A
214,Why is a confusion matrix helpful?,It shows classification performance.,It measures training loss.,It predicts future outcomes.,It replaces test data.,A
215,Why is dropout used during training?,It prevents overfitting by turning off neurons.,It adds noise to output.,It resets batch size.,It adjusts learning rate.,A
216,Why is an API gateway useful in microservices?,It manages requests between services.,It merges logs into one file.,It encrypts mobile apps.,It slows traffic.,A
217,Why is indexing used in databases?,It speeds up search queries.,It hides primary keys.,It reduces storage space.,It filters column types.,A
218,Why is a load balancer used in web services?,It splits traffic among servers.,It deletes cache on reload.,It switches IP addresses.,It generates backup logs.,A
219,Why is multi-factor authentication safer?,It combines multiple ID methods.,It uses stronger passwords.,It hides the login screen.,It deletes session history.,A
220,Why are epochs important in training models?,They define passes through data.,They replace optimizers.,They reduce feature count.,They modify input format.,A
221,Why is HTTPS considered secure for data transfer?,It encrypts the communication channel.,It reduces file size.,It hides the URL path.,It blocks image loading.,A
222,Why do we use firewalls in network systems?,They block unauthorized access.,They delete backup files.,They restart applications.,They scan user photos.,A
223,Why is CPU cache useful in computing?,It stores frequently used data nearby.,It extends battery life.,It compresses files.,It controls screen brightness.,A
224,Why is accuracy alone misleading in imbalanced data?,It ignores the minority class performance.,It lowers model complexity.,It changes the loss function.,It removes class labels.,A
225,Why do we compress files before transmission?,To reduce the size for faster transfer.,To secure the content.,To rename the extension.,To change file format.,A
226,Why is latency important in real-time systems?,It impacts how quickly responses are received.,It changes hardware speed.,It controls display resolution.,It encrypts voice data.,A
227,Why do we use the 'ping' command?,To check network connectivity.,To increase download speed.,To reset the modem.,To trace active ports.,A
228,Why is modular code preferred in large projects?,It's easier to maintain and debug.,It runs on mobile faster.,It blocks external updates.,It rewrites itself.,A
229,Why is MFA considered a best practice?,It reduces risk with multiple verification steps.,It hides password length.,It disables device syncing.,It renames login fields.,A
230,Why are backups essential in IT systems?,They restore data after loss or failure.,They double hard drive space.,They convert files to apps.,They reduce CPU usage.,A
231,Why is model interpretability important in AI?,It helps understand how predictions are made.,It speeds up inference time.,It limits the model size.,It reduces data noise.,A
232,Why are strong passwords recommended?,They make it harder to guess.,They boost internet speed.,They update apps faster.,They shorten session time.,A
233,Why is GitHub useful for developers?,It hosts and manages code online.,It runs antivirus checks.,It compresses video files.,It installs device drivers.,A
234,Why do cloud apps need autoscaling?,To handle traffic changes without manual work.,To reset all app settings.,To store user credentials.,To duplicate mobile data.,A
235,Why is the learning rate important in training?,It controls how much weights are updated.,It deletes the cost function.,It sorts input features.,It hides output classes.,A
236,Why is data anonymization used?,To protect user identity in shared data.,To randomize algorithm output.,To filter training logs.,To encrypt IP addresses.,A
237,Why is a test set used in machine learning?,To evaluate model performance on new data.,To tune learning rate.,To drop noisy samples.,To create new classes.,A
238,Why do web apps use sessions?,To store user state between requests.,To encrypt webpage titles.,To block slow users.,To prevent screen flicker.,A
239,Why is syntax highlighting helpful in code editors?,It makes code easier to read.,It doubles runtime.,It removes syntax rules.,It compiles scripts faster.,A
240,Why is server monitoring essential for uptime?,It helps detect problems early.,It shuts down all logs.,It changes IP settings.,It uploads new hardware.,A
241,Why is tokenization used in NLP pipelines?,It splits text into smaller units.,It summarizes long text.,It removes grammar tags.,It translates speech to text.,A
242,Why is bias-variance tradeoff important in modeling?,It balances model accuracy and generalization.,It sorts predictions by size.,It lowers dataset memory.,It filters missing rows.,A
243,Why is load testing performed on apps?,To measure performance under stress.,To install extra plugins.,To reduce cache size.,To compile the UI code.,A
244,Why do we use cron jobs in servers?,To schedule repeated tasks automatically.,To improve graphics rendering.,To block malware attempts.,To extend server memory.,A
245,Why is HTTPS safer than HTTP?,It uses encryption for all traffic.,It speeds up DNS resolution.,It updates browser plugins.,It hides user preferences.,A
246,Why are microservices loosely coupled?,So each part can change independently.,So they run on a single port.,So they share data files.,So they print console logs.,A
247,Why is data visualization important?,It makes complex data easier to grasp.,It lowers CPU usage.,It adds colors to code.,It hides data patterns.,A
248,Why is ReLU used in neural networks?,It's fast and avoids vanishing gradients.,It predicts future classes.,It adds new hidden layers.,It compresses matrix output.,A
249,Why do many APIs return JSON data?,It is lightweight and easy to parse.,It encrypts all keys.,It stores data as tables.,It removes nested fields.,A
250,Why is an SSL certificate vital for a website?,"It enables secure, encrypted traffic.",It hides image names.,It blocks JavaScript calls.,It shortens domain length.,A
251,Why is two-factor authentication more secure than passwords?,It adds a second verification layer.,It replaces firewalls.,It removes login logs.,It blocks JavaScript files.,A
252,Why do we normalize data in preprocessing?,To bring features to the same scale.,To remove target values.,To shorten training time.,To increase output classes.,A
253,Why are containers better than VMs for microservices?,They are lightweight and start faster.,They require no storage.,They use only static IPs.,They encrypt all traffic.,A
254,Why is Python popular for data science?,It has rich libraries and clean syntax.,It runs only on Windows.,It skips compile time.,It limits function size.,A
255,Why do we validate data before training?,To ensure correctness and consistency.,To reduce class imbalance.,To create new features.,To merge duplicate fields.,A
256,Why is serverless architecture scalable?,It adjusts resources based on load.,It skips deployment scripts.,It runs on static files.,It blocks code versioning.,A
257,Why is version control essential in teams?,It tracks and merges code changes.,It speeds up download time.,It clears log history.,It auto-generates tests.,A
258,Why do we perform data cleaning?,To fix or remove invalid entries.,To train the model faster.,To drop output columns.,To enhance UI colors.,A
259,Why do APIs use rate limiting?,To prevent abuse and overload.,To slow down browsers.,To remove API keys.,To encrypt user tokens.,A
260,Why are CDN networks faster for users?,They serve content from nearby servers.,They boost screen resolution.,They change page colors.,They delay JavaScript.,A
