Question Number,Question,Option A,Option B,Option C,Option D,Correct Option
417,Why is net promoter score (NPS) tracked?,It measures customer loyalty and satisfaction.,It predicts ad clicks.,It lowers bounce rate.,It monitors server uptime.,A
418,Why is customer journey mapping useful?,It reveals user experience across touchpoints.,It builds product lists.,It changes currency rates.,It renames web pages.,A
419,Why is churn rate a concern for subscription models?,It indicates customer loss over time.,It boosts referral rates.,It filters user feedback.,It increases sales targets.,A
420,Why is pricing strategy important in business?,It affects profitability and market positioning.,It logs cash flow.,It disables competition.,It shortens pay cycles.,A
421,Why is market research essential before launching a product?,It helps understand customer needs and market gaps.,It lowers raw material cost.,It automates support tickets.,It updates user interfaces.,A
422,Why is strategic planning important in business?,It aligns long-term goals with daily operations.,It cuts training costs.,It exports billing records.,It renames policies.,A
423,Why is social proof effective in marketing?,It builds trust through testimonials or usage stats.,It hides company flaws.,It reduces product lines.,It switches ad platforms.,A
424,Why is influencer marketing growing in popularity?,It leverages trusted individuals to reach audiences.,It stops data loss.,It changes product features.,It boosts inventory count.,A
425,Why is CRM important for sales teams?,It manages customer relationships and data.,It edits product specs.,It blocks unauthorized access.,It updates staff shifts.,A
426,Why is user experience (UX) critical for websites?,It impacts satisfaction and conversion rates.,It removes login options.,It stops auto-scroll.,It tracks video views.,A
427,Why is a mission statement important?,It defines a company's purpose and direction.,It lists payment terms.,It explains pricing.,It reduces marketing costs.,A
428,Why is agile methodology used in product teams?,"It promotes fast, iterative development.",It increases ad revenue.,It slows product launches.,It reduces UI testing.,A
429,Why is a USP (Unique Selling Proposition) valuable?,It distinguishes a product from competitors.,It lowers development time.,It expands manufacturing space.,It combines product lines.,A
430,Why is digital transformation vital for modern businesses?,It improves efficiency through technology.,It delays change.,It increases overhead.,It copies past processes.,A
431,Why is lead generation crucial in marketing?,It attracts potential customers into the sales funnel.,It lowers product quality.,It merges pricing tiers.,It filters employee resumes.,A
432,Why is market segmentation a strategic tool?,It enables targeting of specific audience groups.,It restricts ad platforms.,It removes branding.,It compresses product descriptions.,A
433,Why is upselling used by businesses?,It increases revenue by promoting higher-value items.,It deletes product options.,It resets customer history.,It disables user accounts.,A
434,Why is omnichannel strategy important in retail?,It provides seamless customer experiences across platforms.,It doubles stock prices.,It blocks mobile apps.,It lowers warehouse costs.,A
435,Why is performance marketing result-driven?,It ties payment to specific actions like clicks or sales.,It avoids measurement.,It hides metrics.,It duplicates campaigns.,A
436,Why are landing pages important in online marketing?,They focus user attention on a single goal.,They extend product catalogs.,They speed up server restarts.,They block search indexing.,A
437,Why is data analytics valuable in business decisions?,It uncovers patterns and insights to guide strategy.,It limits automation.,It locks files.,It removes dashboards.,A
438,Why is PPC (Pay-Per-Click) advertising widely used?,It gives measurable traffic based on ad spend.,It runs offline ads.,It shortens URLs.,It adjusts billing cycles.,A
439,Why is business agility a competitive advantage?,It helps adapt quickly to market changes.,It increases payroll.,It adds user delays.,It slows marketing.,A
440,Why is conversion rate a key marketing metric?,It shows the effectiveness of turning visitors into customers.,It tracks page loading time.,It reduces ad copy length.,It merges product IDs.,A
441,Why is customer onboarding important for SaaS companies?,It ensures users understand and use the product effectively.,It removes billing options.,It hides product features.,It filters error logs.,A
442,Why is predictive analytics useful in business?,It helps forecast trends and customer behavior.,It delays product launches.,It shortens email length.,It compresses customer data.,A
443,Why is supply chain management critical for retailers?,It optimizes flow of goods from suppliers to customers.,It boosts graphic design.,It tracks app downloads.,It filters pop-up ads.,A
444,Why is brand loyalty valuable in marketing?,It results in repeat purchases and advocacy.,It hides return policies.,It reduces delivery speed.,It limits feedback forms.,A
445,Why is personalization important in ecommerce?,It tailors the shopping experience to the user.,It disables cart tracking.,It lowers product visibility.,It resets website layout.,A
446,Why is financial forecasting essential for business planning?,It estimates future revenue and expenses.,It removes annual budgets.,It compresses invoices.,It alters payment gateways.,A
447,Why is omnipresence a marketing strength?,It increases brand recognition across channels.,It lowers referral bonuses.,It delays order fulfillment.,It encrypts video content.,A
448,Why is stakeholder communication key in project management?,It aligns expectations and improves transparency.,It reduces deliverables.,It blocks task updates.,It ends collaboration.,A
449,Why is pricing psychology used in retail?,It influences buying decisions through perception.,It limits discount codes.,It merges checkout pages.,It tracks barcode changes.,A
450,Why is a strong call to action (CTA) crucial in marketing content?,It guides users toward a specific goal.,It changes logo design.,It lowers bounce rate.,It lengthens page text.,A
451,Why is referral marketing cost-effective?,It leverages satisfied customers to bring in new ones.,It replaces influencer outreach.,It shortens payment cycles.,It increases warehouse rent.,A
452,Why is market saturation a challenge for startups?,It limits room for growth and new users.,It lowers server uptime.,It reduces payroll.,It improves app latency.,A
453,Why is risk management necessary in project planning?,It prepares for potential setbacks and uncertainties.,It filters social media metrics.,It removes legal teams.,It boosts brand design.,A
454,Why is thought leadership used in content strategy?,It builds authority and trust within a niche.,It simplifies payment methods.,It shortens video ads.,It removes call center load.,A
455,Why is customer retention more profitable than acquisition?,It costs less and increases lifetime value.,It avoids marketing completely.,It lowers software versions.,It increases delivery time.,A
456,Why is benchmarking used in performance reviews?,It compares current performance against industry standards.,It duplicates goals.,It automates payroll.,It changes file names.,A
457,Why is data visualization crucial in reports?,It makes complex information easier to understand.,It extends meetings.,It deletes user sessions.,It disables cookies.,A
458,Why is cross-functional collaboration valuable in business?,It brings diverse perspectives to solve problems.,It removes role clarity.,It shortens vacation time.,It erases project scope.,A
459,Why is mobile optimization critical for ecommerce?,It improves user experience on smaller screens.,It disables shopping carts.,It blocks reviews.,It hides return policies.,A
460,Why is time-to-market a key metric in product launches?,It reflects speed from idea to release.,It increases design complexity.,It duplicates wireframes.,It lowers code quality.,A
461,Why is the liver essential in drug metabolism?,It breaks down and detoxifies medications.,It produces red blood cells.,It stores iron long-term.,It regulates heart rate.,A
462,Why are antibiotics ineffective against viruses?,Viruses don’t have cellular structures targeted by antibiotics.,Viruses are resistant to all medications.,Viruses multiply in blood only.,Viruses increase white blood cells.,A
463,Why is insulin critical for diabetics?,It helps regulate blood glucose levels.,It enhances bone density.,It clears liver toxins.,It boosts oxygen transport.,A
464,Why is patient history important in diagnosis?,It provides context for symptoms and risks.,It increases prescription dosage.,It eliminates the need for testing.,It filters insurance data.,A
465,Why is aseptic technique important during surgery?,It prevents infection by keeping the field sterile.,It increases oxygen flow.,It relaxes patient muscles.,It speeds wound healing.,A
466,Why is the blood-brain barrier significant in pharmacology?,It restricts certain drugs from reaching the brain.,It transports glucose.,It slows brain signals.,It breaks down proteins.,A
467,Why is the ECG used in emergency medicine?,It detects irregular heart rhythms quickly.,It filters lung sounds.,It measures body temperature.,It diagnoses broken bones.,A
468,Why is vaccination important for public health?,It reduces the spread of infectious diseases.,It increases muscle strength.,It speeds up digestion.,It clears nasal passages.,A
469,Why is hydration critical in treating heatstroke?,It restores fluid balance and cools the body.,It raises blood sugar.,It slows breathing.,It narrows blood vessels.,A
470,Why is the spleen important in the immune system?,It filters blood and helps fight infections.,It digests protein.,It stores calcium.,It produces adrenaline.,A
471,Why is the kidney vital for maintaining electrolyte balance?,"It regulates levels of sodium, potassium, and calcium.",It controls insulin secretion.,It absorbs dietary fat.,It produces red blood cells.,A
472,Why is hemoglobin important in the circulatory system?,It carries oxygen from the lungs to tissues.,It digests carbohydrates.,It filters toxins.,It produces bile.,A
473,Why is CPR (cardiopulmonary resuscitation) performed during cardiac arrest?,It helps maintain blood circulation and oxygen flow.,It reduces fever.,It improves digestion.,It restores electrolyte levels.,A
474,Why is the pancreas considered both an endocrine and exocrine gland?,It secretes hormones and digestive enzymes.,It regulates blood pressure.,It absorbs nutrients.,It stores energy.,A
475,Why are antihistamines used to treat allergies?,They block the effects of histamine.,They reduce viral replication.,They increase heart rate.,They enhance bone growth.,A
476,Why is the appendix no longer considered entirely useless?,It may play a role in gut immunity.,It stores calcium.,It filters air.,It produces insulin.,A
477,Why is early detection important in cancer treatment?,It increases the chances of successful treatment.,It avoids all surgeries.,It eliminates immune responses.,It decreases oxygen supply.,A
478,Why is the pulse oximeter used in clinical settings?,It measures blood oxygen saturation.,It tracks hydration level.,It measures vision.,It detects blood sugar.,A
479,Why is antibiotic resistance a global concern?,It makes infections harder to treat.,It increases vaccine costs.,It stops organ function.,It boosts immune memory.,A
480,Why is patient compliance important in chronic disease management?,It ensures effectiveness of long-term treatment.,It reduces blood volume.,It strengthens bones.,It lowers heartbeat.,A
481,Why is informed consent critical before surgical procedures?,It ensures the patient understands and agrees to the risks.,It replaces medical history.,It speeds up recovery.,It avoids anesthesia use.,A
482,Why is the thyroid gland important in metabolism?,It regulates metabolic rate through hormone secretion.,It digests carbohydrates.,It filters blood.,It stores vitamin D.,A
483,Why are anticoagulants prescribed to some patients?,They prevent blood clot formation.,They lower blood sugar.,They boost lung capacity.,They increase appetite.,A
484,Why is the Glasgow Coma Scale used in emergency care?,It assesses a patient’s level of consciousness.,It evaluates muscle mass.,It controls heartbeat.,It adjusts oxygen levels.,A
485,Why is the right ventricle important in circulation?,It pumps deoxygenated blood to the lungs.,It absorbs nutrients.,It filters waste.,It produces plasma.,A
486,Why is sterile technique essential in wound care?,It reduces risk of infection and promotes healing.,It increases platelet count.,It raises white blood cell levels.,It slows bleeding.,A
487,Why is hypertension called the 'silent killer'?,It often shows no symptoms but causes serious damage.,It causes constant coughing.,It affects only teenagers.,It improves heart rhythm.,A
488,Why is the autonomic nervous system vital in medicine?,It controls involuntary functions like heart rate and digestion.,It filters sensory information.,It repairs brain tissue.,It boosts reflex speed.,A
489,Why is the body’s inflammatory response necessary?,It defends against injury and infection.,It reduces metabolic rate.,It slows cell growth.,It enhances sleep cycles.,A
490,Why is pediatric dosing different from adult dosing?,Children metabolize drugs differently due to body composition.,Children absorb pills faster.,Children prefer syringes.,Children avoid drug resistance.,A
491,Why is telemetry used in cardiac monitoring?,It allows real-time remote observation of heart activity.,It delivers nutrients.,It reduces stress.,It strengthens muscles.,A
492,Why is oxygen therapy used for COPD patients?,It improves oxygen supply to tissues.,It lowers blood sugar.,It reduces inflammation.,It repairs alveoli.,A
493,Why is folic acid important during pregnancy?,It helps prevent neural tube defects in the fetus.,It strengthens bones.,It improves eyesight.,It regulates heartbeat.,A
494,Why is palliative care important in terminal illness?,It focuses on comfort and quality of life.,It aims to cure the condition.,It shortens hospital stay.,It eliminates all symptoms.,A
495,Why is the pituitary gland called the master gland?,It controls hormone secretion in other glands.,It regulates body fat.,It stores enzymes.,It boosts appetite.,A
496,Why is triage important in emergency medicine?,It prioritizes treatment based on urgency.,It monitors vitals only.,It reduces paperwork.,It speeds up billing.,A
497,Why is the diaphragm essential for breathing?,It contracts to expand the lungs during inhalation.,It stores oxygen.,It filters air particles.,It produces mucus.,A
498,Why is electrolyte monitoring important in hospitalized patients?,It ensures proper muscle and nerve function.,It increases hemoglobin.,It improves taste.,It lowers blood clotting.,A
499,Why is the use of IV fluids common in emergency settings?,It rapidly restores hydration and electrolyte balance.,It improves liver enzymes.,It enhances bone density.,It clears ear infections.,A
500,Why is antimicrobial stewardship essential in healthcare?,It promotes responsible antibiotic use to prevent resistance.,It increases pill strength.,It raises white blood cells.,It blocks protein synthesis.,A
